{
  "$schema": "../../specs/identity-benchmark-experiment.schema.json",
  "schema_version": 1,
  "experiment_id": "model-evaluator-smoke-v1",
  "profile": "synthetic-profile.json",
  "body_root": "../..",
  "instance_command": [
    "python3",
    "{body_root}/tests/fixtures/synthetic-instance.py"
  ],
  "models": ["gpt-5.6-luna"],
  "reasoning_efforts": ["low"],
  "identity_modes": ["full-context"],
  "repetitions": 1,
  "timeout_seconds": 600,
  "evaluator": {
    "id": "codex-sol-xhigh-v1",
    "harness": "codex-cli",
    "command": [
      "python3",
      "{body_root}/tests/fixtures/synthetic-evaluator.py"
    ],
    "model": "gpt-5.6-sol",
    "reasoning_effort": "xhigh",
    "rubric_version": "pai-model-judge-v1",
    "timeout_seconds": 600
  }
}
