{
  "$schema": "../../../specs/identity-benchmark-experiment.schema.json",
  "body_root": "../../..",
  "counterfactual_pairs": [
    [
      "population-p002-a-publication-v4",
      "population-p002-b-publication-v4"
    ],
    [
      "population-p010-a-publication-v4",
      "population-p010-b-publication-v4"
    ],
    [
      "population-p018-a-publication-v4",
      "population-p018-b-publication-v4"
    ],
    [
      "population-p026-a-publication-v4",
      "population-p026-b-publication-v4"
    ]
  ],
  "evaluator": {
    "command": [
      "{body_root}/bin/eve-benchmark-evaluator",
      "--body-root",
      "{body_root}"
    ],
    "harness": "codex-cli",
    "id": "codex-sol-xhigh-v2",
    "model": "gpt-5.6-sol",
    "reasoning_effort": "xhigh",
    "rubric_version": "pai-model-judge-v2",
    "timeout_seconds": 600
  },
  "experiment_id": "identity-publication-v4-dev",
  "identity_modes": [
    "installed"
  ],
  "instance_command": [
    "{body_root}/bin/eve-benchmark-instance",
    "--profile",
    "{profile}",
    "--identity-mode",
    "{identity_mode}",
    "--body-root",
    "{body_root}"
  ],
  "models": [
    "gpt-5.6-luna"
  ],
  "population": "population.json",
  "profiles": [
    "profiles/population-p002-a-publication-v4.json",
    "profiles/population-p002-b-publication-v4.json",
    "profiles/population-p010-a-publication-v4.json",
    "profiles/population-p010-b-publication-v4.json",
    "profiles/population-p018-a-publication-v4.json",
    "profiles/population-p018-b-publication-v4.json",
    "profiles/population-p026-a-publication-v4.json",
    "profiles/population-p026-b-publication-v4.json"
  ],
  "reasoning_efforts": [
    "low",
    "medium",
    "high",
    "xhigh"
  ],
  "repetitions": 1,
  "schema_version": 1,
  "timeout_seconds": 600
}
